{
  "$ref": "#/definitions/outreach",
  "definitions": {
    "outreach": {
      "type": "object",
      "properties": {
        "name": {
          "type": "string"
        },
        "recommended_pricing_plan": {
          "type": "string"
        },
        "website_url": {
          "type": "string"
        },
        "scores": {
          "type": "object",
          "properties": {
            "mobile": {
              "type": "object",
              "properties": {
                "design": {
                  "type": "number"
                },
                "performance": {
                  "type": "number"
                },
                "accessibility": {
                  "type": "number"
                },
                "seo": {
                  "type": "number"
                }
              },
              "required": [
                "design",
                "performance",
                "accessibility",
                "seo"
              ],
              "additionalProperties": false
            },
            "desktop": {
              "type": "object",
              "properties": {
                "design": {
                  "type": "number"
                },
                "performance": {
                  "type": "number"
                },
                "accessibility": {
                  "type": "number"
                },
                "seo": {
                  "type": "number"
                }
              },
              "required": [
                "design",
                "performance",
                "accessibility",
                "seo"
              ],
              "additionalProperties": false
            }
          },
          "required": [
            "mobile",
            "desktop"
          ],
          "additionalProperties": false
        },
        "outreached_at": {
          "type": "string"
        },
        "$schema": {
          "type": "string"
        }
      },
      "required": [
        "name",
        "recommended_pricing_plan"
      ],
      "additionalProperties": false
    }
  },
  "$schema": "http://json-schema.org/draft-07/schema#"
}