{
  "name": "Silent Siren Tattoo",
  "website_url": "silentsirentattoo.com",
  "scores": {
    "mobile": {
      "design": 40,
      "performance": 86,
      "accessibility": 93,
      "seo": 100
    },
    "desktop": {
      "design": 40,
      "performance": 91,
      "accessibility": 89,
      "seo": 100
    }
  },
  "recommended_pricing_plan": "fresh"
}
