{
  "name": "Silent Siren Tattoo",
  "recommended_pricing_plan": "fresh",
  "website_url": "https://silentsirentattoo.com",
  "scores": {
    "mobile": {
      "design": 40,
      "performance": 86,
      "accessibility": 93,
      "seo": 100
    },
    "desktop": {
      "design": 40,
      "performance": 91,
      "accessibility": 89,
      "seo": 100
    }
  },
  "outreached_at": "2024-03-21"
}
